{
  "$schema": "https://json-schema.org/draft/2020-12/schema",
  "$id": "https://schemas.piqsavi.com/sprint29/decision-context-v1.schema.json",
  "title": "PiqSavi Sprint 29 decision context v1",
  "type": "object",
  "additionalProperties": false,
  "required": [
    "schema_version",
    "data_classification",
    "decision_id",
    "context_version",
    "owner",
    "evaluated_products",
    "recommendation",
    "evidence",
    "unknowns",
    "affiliate_neutrality",
    "created_at",
    "updated_at"
  ],
  "properties": {
    "schema_version": { "const": "1.0" },
    "data_classification": { "const": "non_live_contract_fixture" },
    "decision_id": { "type": "string", "format": "uuid" },
    "context_version": { "type": "integer", "minimum": 1 },
    "owner": { "$ref": "#/$defs/owner" },
    "evaluated_products": {
      "type": "array",
      "minItems": 2,
      "items": { "$ref": "#/$defs/evaluatedProduct" }
    },
    "recommendation": { "$ref": "#/$defs/recommendation" },
    "evidence": {
      "type": "array",
      "minItems": 1,
      "items": { "$ref": "#/$defs/evidence" }
    },
    "unknowns": {
      "type": "array",
      "items": { "type": "string", "minLength": 1 },
      "uniqueItems": true
    },
    "affiliate_neutrality": { "$ref": "#/$defs/affiliateNeutrality" },
    "created_at": { "type": "string", "format": "date-time" },
    "updated_at": { "type": "string", "format": "date-time" }
  },
  "$defs": {
    "sha256": {
      "type": "string",
      "pattern": "^[0-9a-f]{64}$"
    },
    "owner": {
      "type": "object",
      "additionalProperties": false,
      "required": ["principal_type", "principal_id", "session_id", "expires_at"],
      "properties": {
        "principal_type": { "enum": ["guest", "account"] },
        "principal_id": { "type": "string", "minLength": 1, "maxLength": 128 },
        "session_id": { "type": "string", "minLength": 1, "maxLength": 128 },
        "expires_at": { "type": "string", "format": "date-time" }
      }
    },
    "canonicalPiqScore": {
      "type": "object",
      "additionalProperties": false,
      "required": ["value", "authority", "semantics_version", "snapshot_sha256"],
      "properties": {
        "value": { "type": "number", "minimum": 0, "maximum": 100 },
        "authority": { "const": "canonical-piqscore-dealscore-engine" },
        "semantics_version": { "type": "string", "minLength": 1 },
        "snapshot_sha256": { "$ref": "#/$defs/sha256" }
      }
    },
    "evaluatedProduct": {
      "type": "object",
      "additionalProperties": false,
      "required": ["product_id", "display_name", "variant", "canonical_piqscore"],
      "properties": {
        "product_id": { "type": "string", "minLength": 1, "maxLength": 128 },
        "display_name": { "type": "string", "minLength": 1, "maxLength": 200 },
        "variant": { "type": "string", "minLength": 1, "maxLength": 200 },
        "canonical_piqscore": { "$ref": "#/$defs/canonicalPiqScore" }
      }
    },
    "recommendation": {
      "type": "object",
      "additionalProperties": false,
      "required": [
        "authority",
        "decision",
        "best_piq_product_id",
        "alternative_product_ids",
        "snapshot_sha256"
      ],
      "properties": {
        "authority": { "const": "canonical-recommendation-engine" },
        "decision": { "enum": ["buy", "wait", "consider", "avoid"] },
        "best_piq_product_id": { "type": "string", "minLength": 1 },
        "alternative_product_ids": {
          "type": "array",
          "items": { "type": "string", "minLength": 1 },
          "uniqueItems": true
        },
        "snapshot_sha256": { "$ref": "#/$defs/sha256" }
      }
    },
    "evidence": {
      "type": "object",
      "additionalProperties": false,
      "required": [
        "evidence_id",
        "product_id",
        "topic",
        "fact",
        "source",
        "captured_at",
        "freshness",
        "provenance_sha256"
      ],
      "properties": {
        "evidence_id": { "type": "string", "minLength": 1, "maxLength": 128 },
        "product_id": { "type": "string", "minLength": 1, "maxLength": 128 },
        "topic": { "type": "string", "minLength": 1, "maxLength": 128 },
        "fact": { "type": "string", "minLength": 1, "maxLength": 1000 },
        "source": { "type": "string", "minLength": 1, "maxLength": 256 },
        "captured_at": { "type": "string", "format": "date-time" },
        "freshness": { "enum": ["fresh", "stale", "unknown"] },
        "provenance_sha256": { "$ref": "#/$defs/sha256" }
      }
    },
    "affiliateNeutrality": {
      "type": "object",
      "additionalProperties": false,
      "required": [
        "commission_influenced_candidates",
        "commission_influenced_scores",
        "commission_influenced_recommendation",
        "commission_influenced_ordering"
      ],
      "properties": {
        "commission_influenced_candidates": { "const": false },
        "commission_influenced_scores": { "const": false },
        "commission_influenced_recommendation": { "const": false },
        "commission_influenced_ordering": { "const": false }
      }
    }
  }
}
