{
  "schema_version": "1.0",
  "data_classification": "non_live_contract_fixture",
  "decision_id": "00000000-0000-4000-8000-000000000029",
  "context_version": 1,
  "owner": {
    "principal_type": "guest",
    "principal_id": "guest-contract-29",
    "session_id": "session-contract-29",
    "expires_at": "2030-01-01T00:30:00Z"
  },
  "evaluated_products": [
    {
      "product_id": "apple-iphone-17-pro-max",
      "display_name": "iPhone 17 Pro Max",
      "variant": "contract-fixture-variant",
      "canonical_piqscore": {
        "value": 87,
        "authority": "canonical-piqscore-dealscore-engine",
        "semantics_version": "protected-existing-authority-v1",
        "snapshot_sha256": "aaaaaaaaaaaaaaaaaaaaaaaaaaaaaaaaaaaaaaaaaaaaaaaaaaaaaaaaaaaaaaaa"
      }
    },
    {
      "product_id": "samsung-galaxy-s25-ultra-512gb",
      "display_name": "Samsung Galaxy S25 Ultra 512GB",
      "variant": "512GB contract-fixture-variant",
      "canonical_piqscore": {
        "value": 83,
        "authority": "canonical-piqscore-dealscore-engine",
        "semantics_version": "protected-existing-authority-v1",
        "snapshot_sha256": "bbbbbbbbbbbbbbbbbbbbbbbbbbbbbbbbbbbbbbbbbbbbbbbbbbbbbbbbbbbbbbbb"
      }
    }
  ],
  "recommendation": {
    "authority": "canonical-recommendation-engine",
    "decision": "consider",
    "best_piq_product_id": "apple-iphone-17-pro-max",
    "alternative_product_ids": ["samsung-galaxy-s25-ultra-512gb"],
    "snapshot_sha256": "cccccccccccccccccccccccccccccccccccccccccccccccccccccccccccccccc"
  },
  "evidence": [
    {
      "evidence_id": "fixture-battery-iphone",
      "product_id": "apple-iphone-17-pro-max",
      "topic": "battery",
      "fact": "non-live fixture battery evidence A",
      "source": "contract-fixture://battery/a",
      "captured_at": "2030-01-01T00:00:00Z",
      "freshness": "unknown",
      "provenance_sha256": "dddddddddddddddddddddddddddddddddddddddddddddddddddddddddddddddd"
    },
    {
      "evidence_id": "fixture-battery-samsung",
      "product_id": "samsung-galaxy-s25-ultra-512gb",
      "topic": "battery",
      "fact": "non-live fixture battery evidence B",
      "source": "contract-fixture://battery/b",
      "captured_at": "2030-01-01T00:00:00Z",
      "freshness": "unknown",
      "provenance_sha256": "eeeeeeeeeeeeeeeeeeeeeeeeeeeeeeeeeeeeeeeeeeeeeeeeeeeeeeeeeeeeeeee"
    }
  ],
  "unknowns": ["live marketplace facts are intentionally absent"],
  "affiliate_neutrality": {
    "commission_influenced_candidates": false,
    "commission_influenced_scores": false,
    "commission_influenced_recommendation": false,
    "commission_influenced_ordering": false
  },
  "created_at": "2030-01-01T00:00:00Z",
  "updated_at": "2030-01-01T00:00:00Z"
}
